{
  "schema_version": "project-eval-case-control/v1",
  "case_id": "unconfigured-private-store",
  "materialization": {"mode": "history", "source": null, "remove_paths": [], "history": [{"source": "history/initial", "message": "Synthetic project baseline"}]},
  "assertions": [
    {"assertion_id": "private-entry", "kind": "file_exists", "path": ".eval-private/todo-capture/_general/tooling-parser-cleanup.md", "expected": null},
    {"assertion_id": "private-location", "kind": "file_contains", "path": ".eval-private/todo-capture/_general/tooling-parser-cleanup.md", "expected": "src/parser.py"},
    {"assertion_id": "no-project-config", "kind": "file_absent", "path": ".todo-capture.toml", "expected": null},
    {"assertion_id": "no-project-entry", "kind": "file_absent", "path": ".todo/_general/tooling-parser-cleanup.md", "expected": null},
    {"assertion_id": "source-present", "kind": "file_contains", "path": "src/parser.py", "expected": "def parse_ids(raw):"},
    {"assertion_id": "private-report", "kind": "json_equals", "path": "answer.json", "expected": {"status": "captured", "backend": "private", "store": ".eval-private/todo-capture", "reason": "none", "provider_adapter_required": false}}
  ],
  "checks": [],
  "hidden_grader": null,
  "trajectory": null,
  "reconstruction": null
}
